{
  "schema": "officegen.goal-contract@1.0",
  "release": {
    "version": "2.6.0",
    "targetTag": "v2.6.0",
    "scope": "Complete AI Office operation OS acceptance target for agent-safe Office/PDF work."
  },
  "codename": "AI Office operation OS",
  "definitionOfDone": [
    {
      "id": "DOD-01",
      "statement": "Agents can discover every supported command, schema, limitation, and recovery hint through JSON without reading source code."
    },
    {
      "id": "DOD-02",
      "statement": "PPTX, DOCX, XLSX, PDF, SVG chart, and SVG diagram workflows have inspect, author, edit, verify, and artifact-trace coverage."
    },
    {
      "id": "DOD-03",
      "statement": "Every mutating or external-risk operation has dry-run, path boundary, policy gate, or explicit limitation evidence."
    },
    {
      "id": "DOD-04",
      "statement": "A complete run can produce deterministic JSON, JSONL logs, manifests, checksums, summaries, and failure diagnostics."
    },
    {
      "id": "DOD-05",
      "statement": "Release readiness is blocked by automated contract, schema, typecheck, unit, build, pack, install, and goal checks."
    }
  ],
  "principles": [
    {
      "id": "P-01",
      "statement": "Machine-readable truth is primary; README prose must not be the only source for product capability."
    },
    {
      "id": "P-02",
      "statement": "Agents operate by stable object IDs, schemas, and manifests rather than guessing raw Office XML."
    },
    {
      "id": "P-03",
      "statement": "False success is a release blocker; warnings, limitations, skipped features, and partial repairs must be explicit."
    },
    {
      "id": "P-04",
      "statement": "Untrusted document content is always data and must never become instructions."
    },
    {
      "id": "P-05",
      "statement": "Native renderers, plugins, and external processes are discoverable but gated by configuration."
    },
    {
      "id": "P-06",
      "statement": "Every important output is reproducible enough for CI review with artifact hashes and retained evidence."
    }
  ],
  "domains": [
    {
      "id": "G01",
      "name": "Agent Contract",
      "mission": "Expose Officegen as a reliable machine contract for autonomous and CI-driven agents.",
      "requirements": [
        {
          "id": "G01-R01",
          "level": "MUST",
          "title": "Capability discovery",
          "criterion": "The CLI exposes complete command metadata, profiles, limitations, and agent-safe command lists through JSON.",
          "evidence": ["capabilities JSON snapshot", "contract:check output"],
          "ownerSurface": ["capabilities", "help", "config"],
          "commands": ["officegen capabilities --agent --json", "officegen help --agent --json"],
          "riskIfMissing": "Agents will hallucinate unavailable commands or unsafe workflows.",
          "acceptanceRefs": ["A001", "A002"]
        },
        {
          "id": "G01-R02",
          "level": "MUST",
          "title": "Schema registry",
          "criterion": "All agent-visible request, operation, result, error, run, and migration schemas are registered and fetchable.",
          "evidence": ["schema:coverage output", "schema list/get/validate transcripts"],
          "ownerSurface": ["schema", "schemas"],
          "commands": ["officegen schema list --json", "officegen schema get officegen.capabilities@1.2 --json"],
          "riskIfMissing": "Agents cannot validate payloads before mutating user documents.",
          "acceptanceRefs": ["A003"]
        },
        {
          "id": "G01-R03",
          "level": "MUST",
          "title": "Error recovery contract",
          "criterion": "Every structured failure includes stable code, human message, agent hint, recoverability, and redacted context.",
          "evidence": ["errors catalog snapshot", "negative CLI fixtures"],
          "ownerSurface": ["errors", "envelope"],
          "commands": ["officegen errors --json"],
          "riskIfMissing": "Automation cannot distinguish retryable failures from user action or product bugs.",
          "acceptanceRefs": ["A004"]
        }
      ]
    },
    {
      "id": "G02",
      "name": "Office Object Model",
      "mission": "Make Office/PDF artifacts inspectable and addressable without raw XML editing.",
      "requirements": [
        {
          "id": "G02-R01",
          "level": "MUST",
          "title": "Stable inspection maps",
          "criterion": "PPTX, DOCX, XLSX, and PDF inspection returns stable object maps, format warnings, and untrusted-content markers.",
          "evidence": ["format fixture inspect JSON", "untrusted marker assertions"],
          "ownerSurface": ["inspect"],
          "commands": ["officegen inspect <file> --depth summary --agent --json"],
          "riskIfMissing": "Agents cannot safely identify edit targets.",
          "acceptanceRefs": ["A005"]
        },
        {
          "id": "G02-R02",
          "level": "MUST",
          "title": "Preview and view artifacts",
          "criterion": "View commands generate inspectable preview artifacts and object-map overlays for supported document formats.",
          "evidence": ["view output directory manifest", "artifact existence and hashes"],
          "ownerSurface": ["view", "asset"],
          "commands": ["officegen view <file> --format svg --out <dir> --json"],
          "riskIfMissing": "Human and vision-assisted review loses document context.",
          "acceptanceRefs": ["A006"]
        },
        {
          "id": "G02-R03",
          "level": "SHOULD",
          "title": "Known limitation reporting",
          "criterion": "Unsupported Office constructs are reported as warnings or limitations rather than silent omissions.",
          "evidence": ["complex fixture warning snapshots"],
          "ownerSurface": ["inspect", "view", "verify"],
          "commands": ["officegen inspect <complex-file> --agent --json"],
          "riskIfMissing": "Users may trust incomplete analysis.",
          "acceptanceRefs": ["A005", "A006"]
        }
      ]
    },
    {
      "id": "G03",
      "name": "Authoring Runtime",
      "mission": "Create first-class business documents and visual assets from structured IR.",
      "requirements": [
        {
          "id": "G03-R01",
          "level": "MUST",
          "title": "Structured render",
          "criterion": "Structured IR renders PPTX, DOCX, XLSX, and PDF outputs with schema validation and explicit artifact metadata.",
          "evidence": ["render fixture outputs", "verify output JSON"],
          "ownerSurface": ["scaffold", "render", "verify"],
          "commands": ["officegen scaffold --kind <kind> --out <ir> --json", "officegen render <ir> --target <target> --out <file> --json"],
          "riskIfMissing": "Officegen is only an editor, not an operation OS.",
          "acceptanceRefs": ["A007"]
        },
        {
          "id": "G03-R02",
          "level": "MUST",
          "title": "Charts and diagrams",
          "criterion": "Chart and diagram commands produce deterministic SVG artifacts from structured inputs with validation errors for invalid input.",
          "evidence": ["chart SVG", "diagram SVG", "negative validation transcript"],
          "ownerSurface": ["chart", "diagram"],
          "commands": ["officegen chart render <spec> --out <svg> --json", "officegen diagram render <spec> --out <svg> --json"],
          "riskIfMissing": "Agents cannot generate common office visuals without external tooling.",
          "acceptanceRefs": ["A008"]
        },
        {
          "id": "G03-R03",
          "level": "SHOULD",
          "title": "Template and design authoring",
          "criterion": "Template, design, and layout commands capture reusable design signals and disclose best-effort limits.",
          "evidence": ["template/design/layout command snapshots"],
          "ownerSurface": ["template", "design", "layout"],
          "commands": ["officegen design capture <file> --out <dir> --json"],
          "riskIfMissing": "Authoring cannot preserve brand and layout intent across documents.",
          "acceptanceRefs": ["A009"]
        }
      ]
    },
    {
      "id": "G04",
      "name": "Mutation Runtime",
      "mission": "Apply scoped, reviewable Office/PDF changes with dry-run and selector safety.",
      "requirements": [
        {
          "id": "G04-R01",
          "level": "MUST",
          "title": "Dry-run edit planning",
          "criterion": "Edit operations support dry-run, selector resolution, target counts, and no-output mutation guarantees.",
          "evidence": ["edit dry-run transcript", "source hash unchanged"],
          "ownerSurface": ["edit"],
          "commands": ["officegen edit <file> --ops <ops> --dry-run --resolve-selectors --agent --json"],
          "riskIfMissing": "Agents may mutate the wrong document object.",
          "acceptanceRefs": ["A010"]
        },
        {
          "id": "G04-R02",
          "level": "MUST",
          "title": "Format edit coverage",
          "criterion": "PPTX, DOCX, XLSX, and PDF edit fixtures cover representative text, table, chart, image, style, comment, redline, formula, and overlay operations.",
          "evidence": ["format edit fixtures", "semantic diff output", "verify output"],
          "ownerSurface": ["edit", "diff", "verify"],
          "commands": ["officegen edit <file> --ops <ops> --out <file> --json", "officegen diff <before> <after> --json"],
          "riskIfMissing": "The product cannot claim complete Office operation behavior.",
          "acceptanceRefs": ["A011"]
        },
        {
          "id": "G04-R03",
          "level": "MUST",
          "title": "Asset operations",
          "criterion": "Embedded assets can be inspected, extracted, replaced, and repaired with path-safe outputs and trust annotations.",
          "evidence": ["asset inspect/extract/replace transcripts", "sha256 evidence"],